data,canal,tema,resumo,resolvido
2025-09-15,chat,Análise de crédito,Cliente solicitou avaliação de score para empréstimo pessoal,sim
2025-09-22,telefone,Simulação de empréstimo,Cliente pediu simulação de crédito de R$15000 e prazo de pagamento,sim
2025-10-01,chat,Score de crédito,Cliente pediu explicação sobre como o CredIA calcula o risco de crédito,sim
2025-10-12,chat,Limite aprovado,Cliente consultou limite máximo de crédito aprovado no aplicativo,sim
2025-10-25,email,Documentação de renda,Cliente enviou comprovante de renda para validação do crédito,sim

